{
  "$schema": "https://raw.githubusercontent.com/tinyland-inc/site.scaffold/main/docs/schemas/tinyland-repo-manifest.schema.json",
  "schema_version": 1,
  "repo": {
    "name": "gdrive-mounts",
    "github": "Jesssullivan/gdrive-mounts",
    "description": "IaC for mounting multiple Google Workspace orgs' Drives as navigable, indexable remote filesystems (rclone, nix flake, bazelisk candidate graph), deployed via lab home-manager."
  },
  "taxonomy": {
    "primary_role": "org-utility",
    "layers": ["org-wide-repo-contract", "bazel-package-cache-rbe"]
  },
  "contracts": {
    "agent_contract": "AGENTS.md",
    "just": "justfile",
    "nix": "flake.nix",
    "github_actions": ".github/workflows",
    "secrets_scan": "gitleaks",
    "conformance": "nix develop --command just check"
  },
  "boundaries": {
    "owns_runtime_backend": false,
    "owns_auth": false,
    "owns_payments": false,
    "owns_activitypub_delivery": false,
    "owns_live_broker_fetch": false,
    "owns_static_projection_ingest": false,
    "owns_gitops_apply": false,
    "owns_cloudflare_mutation": false,
    "owns_bazel_module_authority": false
  },
  "authorities": {
    "ci_templates": "tinyland-inc/ci-templates",
    "cache_rbe_authority": "tinyland-inc/GloriousFlywheel"
  },
  "supply_chain": {
    "sbom": {
      "status": "not-required",
      "formats": [],
      "notes": "No package artifact is published (shell scripts + a nix flake output consumed in-tree by lab home-manager); revisit if a bazel-registry publish lane appears."
    }
  }
}
